{
  "accelerator": {
    "name": "Mozilla Builders",
    "website": "https://builders.mozilla.org/",
    "csv_file": "public/events-archive.json",
    "slug": "mozilla-builders"
  },
  "status": "needs_review",
  "checked_at": "2026-10-26",
  "confidence": "low",
  "summary": "Mozilla Builders supports open-source AI projects through collaborations, programming and community. Current cohort dates and award terms were not confirmed.",
  "proposed_event": null,
  "sources": [
    {
      "title": "Mozilla Builders \u2014 official program information",
      "url": "https://builders.mozilla.org/",
      "publisher": null,
      "accessed_at": "2026-10-26",
      "supports": "Mozilla Builders supports open-source AI projects through collaborations, programming and community. Current cohort dates and award terms were not confirmed."
    }
  ],
  "notes": []
}
