{
  "accelerator": {
    "name": "Start-Up Chile",
    "website": "https://startupchile.org/postula/",
    "csv_file": "data/accelerators-master.csv",
    "slug": "start-up-chile"
  },
  "status": "needs_review",
  "checked_at": "2026-10-26",
  "confidence": "high",
  "summary": "Start-Up Chile’s official application page says applications will open soon. Build, Ignite and Growth remain listed, but the next opening and closing dates are not confirmed on the checked page.",
  "proposed_event": null,
  "sources": [
    {
      "url": "https://startupchile.org/postula/",
      "title": "Start-Up Chile — Postula",
      "supports": "Applications opening soon, with Build/Ignite/Growth and equity-free support described.",
      "publisher": "Start-Up Chile",
      "accessed_at": "2026-10-26"
    }
  ],
  "notes": [
    "Do not publish estimated November dates from third-party calendars as confirmed dates."
  ]
}
