{
  "accelerator": {
    "name": "Blue Ridge Labs 'Catalyst' 2026",
    "website": "https://beta.robinhood.org/our-work/blue-ridge-labs/catalyst/",
    "csv_file": "public/events-archive.json",
    "slug": "blueridgelabs-catalyst-26"
  },
  "status": "needs_review",
  "checked_at": "2026-10-26",
  "confidence": "low",
  "summary": "The official Catalyst page still lists the 2026 cohort and November 21, 2025 deadline. No later application cycle was confirmed.",
  "proposed_event": null,
  "sources": [
    {
      "title": "Blue Ridge Labs 'Catalyst' 2026 \u2014 official program information",
      "url": "https://beta.robinhood.org/our-work/blue-ridge-labs/catalyst/",
      "publisher": null,
      "accessed_at": "2026-10-26",
      "supports": "The official Catalyst page still lists the 2026 cohort and November 21, 2025 deadline. No later application cycle was confirmed."
    }
  ],
  "notes": []
}
