{
  "accelerator": {
    "name": "Conviction Embed",
    "website": "https://embed.conviction.com/",
    "csv_file": "src/data/imported-accelerators.json",
    "slug": "conviction-embed"
  },
  "status": "needs_review",
  "checked_at": "2026-10-27",
  "confidence": "high",
  "summary": "Embed advertises early applications for cohort seven and $250K on an uncapped, no-discount MFN SAFE (or a recent round price).",
  "proposed_event": null,
  "sources": [
    {
      "url": "https://embed.conviction.com/",
      "title": "Conviction Embed",
      "publisher": "Conviction",
      "supports": "Early applications for cohort seven, $250K investment terms, and rolling-admissions language mixed with undated retreat/demo-day copy.",
      "accessed_at": "2026-10-27"
    },
    {
      "url": "https://embed.conviction.com/apply",
      "title": "Conviction Embed application",
      "publisher": "Conviction",
      "supports": "Application form is accessible; no deadline or cohort year is stated.",
      "accessed_at": "2026-10-27"
    }
  ],
  "notes": [
    "Retreat September 11–13 and Demo Day November 12 lack a year and are mixed with older-cohort text. Cohort-seven early applications are advertised, but no exact schedule is confirmed."
  ]
}
