{
  "accelerator": {
    "name": "Startupbootcamp",
    "website": "https://startupbootcamp.org/",
    "csv_file": "data/accelerators-master.csv",
    "slug": "startupbootcamp"
  },
  "status": "verified",
  "checked_at": "2026-10-26",
  "confidence": "high",
  "summary": "Startupbootcamp Georgia is accepting applications to Dare to Start through November 27, 2026. The hybrid founder-market-fit program runs January 12–March 2, 2027 and requires a company registered in Georgia before joining.",
  "proposed_event": {
    "id": "startupbootcamp-georgia-dare-to-start-2027",
    "name": "Startupbootcamp Georgia — Dare to Start 2027",
    "description": "Two-month hybrid founder-market-fit program for approximately 40 founders. Sector-agnostic and tech-enabled; Georgian company registration required before joining.",
    "organizer": "Startupbootcamp",
    "website": "https://sbcgeorgia.com/programs/dare-to-start",
    "location": {
      "is_virtual": false,
      "is_hybrid": true,
      "venue": null,
      "city": null,
      "city_slug": null,
      "country": "Georgia",
      "country_code": "GE",
      "region_code": "eu"
    },
    "dates": {
      "application_open": null,
      "application_close": "2026-11-27",
      "program_start": "2027-01-12",
      "program_end": "2027-03-02",
      "demo_day": null,
      "timezone": null,
      "date_range_text": "Apply by November 27, 2026. Program January 12–March 2, 2027. Applicants hear back in the week of December 7."
    },
    "categories": {
      "types": [
        "accelerator"
      ],
      "supports": [
        "mentorship",
        "resources"
      ],
      "sectors": [
        "general"
      ]
    },
    "hashtags": [],
    "index": {
      "years": [
        "2026",
        "2027"
      ],
      "region_code": "eu",
      "country_code": "GE",
      "city_slug": null,
      "type_keys": [
        "accelerator"
      ],
      "support_keys": [
        "mentorship",
        "resources"
      ],
      "sector_keys": [
        "general"
      ],
      "date_sort_key": "2026-11-27"
    },
    "verification": "reported",
    "last_verified_utc": "2026-10-26T19:50:16Z"
  },
  "sources": [
    {
      "url": "https://sbcgeorgia.com/programs/dare-to-start",
      "title": "Dare to Start",
      "supports": "Confirms 2027 dates, application deadline, hybrid format and Georgian registration eligibility.",
      "publisher": "Startupbootcamp Georgia",
      "accessed_at": "2026-10-26"
    }
  ],
  "notes": [
    "GEL 50K/150K grants advertised for later MVP/Market Entry stages must not be attributed to Dare to Start."
  ]
}
