{
  "accelerator": {
    "name": "MassChallenge",
    "website": "https://masschallenge.org/2026-2027-challenge-cycle/",
    "csv_file": "data/accelerators-master.csv",
    "slug": "masschallenge"
  },
  "status": "verified",
  "checked_at": "2026-10-27",
  "confidence": "high",
  "summary": "MassChallenge Challenge Cycle 2026–2027 accepts applications October 19–November 9, 2026. This is a separate opportunity from the closed UK accelerator cohort.",
  "proposed_event": {
    "id": "masschallenge",
    "name": "MassChallenge Challenge Cycle 2026–2027",
    "description": "Industry-partner challenges for pre-seed to Series A startups. Worldwide applicants may apply; selected teams must attend required in-person sessions.",
    "organizer": "MassChallenge",
    "website": "https://masschallenge.org/2026-2027-challenge-cycle/",
    "location": {
      "is_virtual": false,
      "is_hybrid": true,
      "venue": null,
      "city": null,
      "city_slug": null,
      "country": null,
      "country_code": null,
      "region_code": "global"
    },
    "dates": {
      "application_open": "2026-10-19",
      "application_close": "2026-11-09",
      "program_start": null,
      "program_end": null,
      "demo_day": null,
      "timezone": null,
      "date_range_text": "Applications October 19–November 9, 2026. Program overview: February–June 2027. Exact attendance schedule and location require confirmation."
    },
    "categories": {
      "types": [
        "accelerator",
        "program"
      ],
      "supports": [
        "mentorship",
        "resources"
      ],
      "sectors": [
        "fintech",
        "health",
        "general"
      ]
    },
    "hashtags": [],
    "index": {
      "years": [],
      "region_code": "global",
      "country_code": null,
      "city_slug": null,
      "type_keys": [],
      "support_keys": [],
      "sector_keys": [],
      "date_sort_key": null
    },
    "verification": "reported",
    "last_verified_utc": null
  },
  "sources": [
    {
      "url": "https://masschallenge.org/2026-2027-challenge-cycle/",
      "title": "MassChallenge 2026–2027 Challenge Cycle",
      "supports": "October 19 opening, November 9 closing, February–June 2027 program overview and pre-seed to Series A eligibility.",
      "publisher": "MassChallenge",
      "accessed_at": "2026-10-27"
    }
  ],
  "notes": [
    "The source contains inconsistent Dallas and Boston location sections and differing event counts. Confirm required attendance with the organizer; no precise kickoff day or location is inferred.",
    "No investment amount, fee, or equity terms were confirmed for this Challenge Cycle.",
    "Do not assign these dates to MassChallenge UK or other MassChallenge programs."
  ]
}
