{
  "accelerator": {
    "name": "Cleantech Open",
    "website": "https://www.cleantechopen.org/en/page/2026-cto-accelerator-en",
    "csv_file": "data/accelerators-master.csv",
    "slug": "cleantech-open"
  },
  "status": "verified",
  "checked_at": "2026-10-26",
  "confidence": "medium",
  "summary": "The official 2026 page says applications closed. Its final event dates have passed.",
  "proposed_event": {
    "id": "cleantech-open-us-2026",
    "name": "Cleantech Open US 2026",
    "description": "Cleantech mentoring and investor access with participation fees; 2026 cohort completed.",
    "organizer": "Cleantech Open",
    "website": "https://www.cleantechopen.org/en/page/2026-cto-accelerator-en",
    "location": {
      "is_virtual": false,
      "is_hybrid": true,
      "venue": null,
      "city": null,
      "city_slug": null,
      "country": "United States",
      "country_code": "US",
      "region_code": "na"
    },
    "dates": {
      "application_open": null,
      "application_close": "2026-04-06",
      "program_start": "2026-05-28",
      "program_end": "2026-10-22",
      "demo_day": null,
      "timezone": null,
      "date_range_text": "2026 applications closed. National Academy May 28–29; Global Forum October 20–22. No 2027 application window confirmed."
    },
    "categories": {
      "types": [
        "accelerator"
      ],
      "supports": [
        "funding",
        "mentorship",
        "resources"
      ],
      "sectors": [
        "climatetech",
        "energy"
      ]
    },
    "hashtags": [],
    "index": {
      "years": [
        "2026"
      ],
      "region_code": "na",
      "country_code": "US",
      "city_slug": null,
      "type_keys": [
        "accelerator"
      ],
      "support_keys": [
        "funding",
        "mentorship",
        "resources"
      ],
      "sector_keys": [
        "climatetech",
        "energy"
      ],
      "date_sort_key": "2026-04-06"
    },
    "verification": "reported",
    "last_verified_utc": "2026-10-26T19:49:07Z"
  },
  "sources": [
    {
      "title": "2026 CTO Accelerator (official search index)",
      "url": "https://www.cleantechopen.org/en/page/2026-cto-accelerator-en",
      "publisher": "Cleantech Open",
      "accessed_at": "2026-10-26",
      "supports": "Closed intake, April 6 cutoff, May academy and October finals."
    }
  ],
  "notes": [
    "Official page has stale weekday references and conflicting academy copy; use dated 2026 schedule cautiously. Direct page returned HTTP 403; official indexed text was inspected."
  ]
}
