{
  "accelerator": {
    "name": "Multicoin Scout Accelerator",
    "website": "https://multicoin.capital/",
    "csv_file": "data/accelerators-crypto.csv",
    "slug": "multicoin-scout-accelerator"
  },
  "status": "not_found",
  "checked_at": "2026-10-26",
  "confidence": "high",
  "summary": "Multicoin Capital’s official site describes venture and public-market crypto investing. No program called Multicoin Scout Accelerator or public accelerator intake was found.",
  "proposed_event": null,
  "sources": [
    {
      "url": "https://multicoin.capital/",
      "title": "Multicoin Capital",
      "supports": "Describes investment funds and current portfolio activity, not a scout accelerator.",
      "publisher": "Multicoin Capital",
      "accessed_at": "2026-10-26"
    }
  ],
  "notes": [
    "Do not present this unconfirmed program name as an active accelerator."
  ]
}
