{
  "accelerator": {
    "name": "a16z Crypto Startup School",
    "website": "https://a16zfrontier.com/accelerator/",
    "csv_file": "data/accelerators-crypto.csv",
    "slug": "a16z-crypto-startup-school"
  },
  "status": "needs_review",
  "checked_at": "2026-10-27",
  "confidence": "high",
  "summary": "a16z CSX publishes a crypto startup accelerator overview and portfolio. The current overview does not publish a new application cutoff or cohort schedule.",
  "proposed_event": null,
  "sources": [
    {
      "title": "Crypto Startup Accelerator",
      "url": "https://a16zfrontier.com/accelerator/",
      "publisher": "a16z",
      "accessed_at": "2026-10-27",
      "supports": "CSX curriculum and portfolio; no current cohort deadline visible."
    }
  ],
  "notes": [
    "Keep the legacy Crypto Startup School slug for continuity. Do not substitute speedrun dates or investment terms for CSX."
  ]
}
