{"accelerator":{"name":"FasterCapital","website":"https://fastercapital.com/","csv_file":"data/accelerators-master.csv","slug":"fastercapital"},"status":"verified","checked_at":"2026-06-09","confidence":"high","summary":"FasterCapital remains active as a Dubai-based global online incubator/accelerator and venture builder. Official pages list rolling availability, with founders able to apply anywhere and anytime, but no fixed 2026 cohort dates or application deadlines are published.","proposed_event":{"id":"fastercapital-global-venture-builder","name":"FasterCapital Global Venture Builder Programs","description":"Global online incubator/venture builder offering fundraising, tech cofounder, growth, and idea-to-product support for startups.","organizer":"FasterCapital","website":"https://www.fastercapital.com/","location":{"is_virtual":true,"is_hybrid":false,"venue":"FasterCapital Dubai offices","city":"Dubai","city_slug":"dubai","country":"United Arab Emirates","country_code":"AE","region_code":"mena"},"dates":{"application_open":null,"application_close":null,"program_start":null,"program_end":null,"demo_day":null,"timezone":null,"date_range_text":"Rolling online applications; official site says founders can apply anywhere and anytime to FasterCapital programs."},"categories":{"types":["accelerator","incubator"],"supports":["funding","mentorship","resources"],"sectors":["general"]},"hashtags":["#global","#online","#funding"],"index":{"years":["2026"],"region_code":"mena","country_code":"AE","city_slug":"dubai","type_keys":["accelerator","incubator"],"support_keys":["funding","mentorship","resources"],"sector_keys":["general"],"date_sort_key":null},"verification":"reported","last_verified_utc":null},"sources":[{"title":"Leading the Way in Global Venture Building and Online Incubation - FasterCapital","url":"https://fastercapital.com/about.html","publisher":"FasterCapital","accessed_at":"2026-06-09","supports":"States FasterCapital is a global venture builder and online incubator based in Dubai; lists main programs including Tech Cofounder, Idea to Product, Grow your Startup, Raise Capital, and Mega Financing; says founders can apply anywhere and anytime; provides Dubai office addresses."},{"title":"Frequently Asked Questions - FasterCapital","url":"https://fastercapital.com/faq.html","publisher":"FasterCapital","accessed_at":"2026-06-09","supports":"Describes FasterCapital as an online incubator/accelerator based in Dubai, country-agnostic, serving startups across stages from idea through Series A and beyond."},{"title":"Raise Capital for Your Startup - FasterCapital","url":"https://fastercapital.com/programs/raise-capital.html","publisher":"FasterCapital","accessed_at":"2026-06-09","supports":"Describes the Raise Capital program process, investor matching, fit for seed through Series B rounds, and clarifies direct investment is handled through other programs when relevant."},{"title":"Find Your Technical Cofounder, Team, or CTO at FasterCapital","url":"https://www.fastercapital.com/technical-cofounder.html","publisher":"FasterCapital","accessed_at":"2026-06-09","supports":"Describes the Tech Cofounder program, technical support network, and claims FasterCapital invests 50% of total costs for that program."}],"notes":["No official fixed 2026 application deadline, cohort start date, program end date, or demo day was found on the reviewed official pages.","Timezone is left null because the reviewed sources identify Dubai as the base/location but do not explicitly state an IANA timezone for applications or programming.","The existing 2025 event appears stale only in the year-specific date_range_text; the program itself is still active with rolling applications."]}