{
  "accelerator": {
    "name": "A16Z Games Speedrun",
    "website": "https://speedrun.a16z.com/",
    "csv_file": "data/accelerators-master.csv",
    "slug": "a16z-games-speedrun"
  },
  "status": "needs_review",
  "checked_at": "2026-10-27",
  "confidence": "high",
  "summary": "Legacy games-specific listing is the same speedrun program; see a16z-speedrun.",
  "proposed_event": null,
  "sources": [
    {
      "title": "speedrun FAQ",
      "url": "https://speedrun.a16z.com/faq",
      "publisher": "a16z speedrun",
      "accessed_at": "2026-10-27",
      "supports": "SR008 window, residency and Demo Day; current investment structure."
    }
  ],
  "notes": [
    "Alias of a16z-speedrun; no separate games cohort verified."
  ]
}
