{
  "accelerator": {
    "name": "HackVC Accelerator",
    "website": "https://www.hack.vc/",
    "csv_file": "data/accelerators-crypto.csv",
    "slug": "hackvc-accelerator"
  },
  "status": "not_found",
  "checked_at": "2026-10-26",
  "confidence": "high",
  "summary": "Hack VC’s current official site describes a venture capital firm investing in crypto, AI and frontier technology. The old accelerator URL is unavailable; no current public accelerator program or application dates were found.",
  "proposed_event": null,
  "sources": [
    {
      "url": "https://www.hack.vc/",
      "title": "Hack VC",
      "supports": "Describes the current venture firm; does not establish an accelerator intake.",
      "publisher": "Hack VC",
      "accessed_at": "2026-10-26"
    }
  ],
  "notes": [
    "Old https://www.hack.vc/accelerator could not be retrieved. Absence of a public program is not proof the firm is inactive."
  ]
}
