{
  "accelerator": {
    "name": "Boost VC",
    "website": "https://www.boost.vc/",
    "csv_file": "data/accelerators-master.csv",
    "slug": "boost-vc"
  },
  "status": "needs_review",
  "checked_at": "2026-10-26",
  "confidence": "high",
  "summary": "Boost VC currently presents itself as a deep-tech pre-seed investor writing $500K checks, without a current accelerator cohort calendar.",
  "proposed_event": null,
  "sources": [
    {
      "title": "Boost VC",
      "url": "https://www.boost.vc/",
      "publisher": "Boost VC",
      "accessed_at": "2026-10-26",
      "supports": "Current pre-seed positioning and $500K checks."
    }
  ],
  "notes": [
    "Removed unsupported rolling-accelerator and ten-week program claims; a fund pitch is not a dated cohort."
  ]
}
