{"accelerator":{"name":"Founders, Inc. Fellowship","website":"https://f.inc/fellowship","csv_file":"src/data/imported-accelerators.json","slug":"founders-inc-fellowship"},"status":"verified","checked_at":"2026-06-09","confidence":"medium","summary":"The old fellowship URL now redirects to Founders, Inc.'s fund/about page. Official pages verify a rolling campus/fund application, San Francisco campus access, funding up to $250k, 4-7% equity, and recurring 4-6 week programs, but no current program named exactly \"Fellowship\" is published.","proposed_event":{"id":"founders-inc-fellowship","name":"Founders, Inc. Fellowship","description":"Rolling Founders, Inc. campus/fund application for emerging-tech founders seeking capital, workspace, office hours, and community.","organizer":"Founders, Inc.","website":"https://f.inc/fellowship","location":{"is_virtual":false,"is_hybrid":false,"venue":"Founders, Inc. campus at Fort Mason","city":"San Francisco","city_slug":"san-francisco","country":"United States","country_code":"US","region_code":"na"},"dates":{"application_open":null,"application_close":null,"program_start":null,"program_end":null,"demo_day":null,"timezone":null,"date_range_text":"General applications are reviewed on a rolling basis between programs; Founders, Inc. says its programs usually run 4 to 6 weeks and the campus page says it runs four programs per year."},"categories":{"types":["fellowship","accelerator","program"],"supports":["funding","mentorship","resources"],"sectors":["ai","hardware","web3","devtools","consumer","deeptech"]},"hashtags":["#FoundersInc","#SanFrancisco","#StartupAccelerator","#EmergingTech"],"index":{"years":["2026"],"region_code":"na","country_code":"US","city_slug":"san-francisco","type_keys":["fellowship","accelerator","program"],"support_keys":["funding","mentorship","resources"],"sector_keys":["ai","hardware","web3","devtools","consumer","deeptech"],"date_sort_key":null},"verification":"reported","last_verified_utc":null},"sources":[{"title":"About our fund | Founders, Inc.","url":"https://f.inc/fellowship","publisher":"Founders, Inc.","accessed_at":"2026-06-09","supports":"The fellowship URL redirects to the official fund/about page; it states Founders, Inc. writes up to $250k checks, asks 4-7% equity, focuses on domains including AI/ML, hardware, Web3, Dev/Tools, and consumer, provides campus access, office hours, fundraising support, hardware lab, community, events, and says programs usually run 4 to 6 weeks."},{"title":"Apply to Founders, Inc.","url":"https://f.inc/apply","publisher":"Founders, Inc.","accessed_at":"2026-06-09","supports":"Official application page says this is a general application to the campus and applications are reviewed on a rolling basis between programs."},{"title":"Our Campus | Founders, Inc.","url":"https://f.inc/campus","publisher":"Founders, Inc.","accessed_at":"2026-06-09","supports":"Official campus page identifies the campus at Fort Mason in San Francisco, describes hardware lab, workspaces, community events, office hours/demo days, and says Founders, Inc. runs four programs per year."},{"title":"Off Season II | Founders, Inc.","url":"https://f.inc/offseason","publisher":"Founders, Inc.","accessed_at":"2026-06-09","supports":"Official current program page shows Founders, Inc. has a dated six-week San Francisco program from June 24 to August 7, 2026, but applications were open until June 7 and are only accepting late applications as of the page text."}],"notes":["No official page found using the exact current title \"Founders, Inc. Fellowship\"; the supplied fellowship URL redirects to the broader Founders, Inc. fund/about page.","Because the named fellowship appears to have been folded into the broader rolling campus/fund application, exact application window and cohort dates are null.","Off Season II has specific 2026 dates, but its regular application deadline was June 7, 2026, which is before today; it was used only as evidence of current program cadence, not as the proposed event."]}