{"accelerator":{"name":"AI2 Incubator","website":"https://www.ai2incubator.com/","csv_file":"src/data/imported-accelerators.json","slug":"ai2-incubator"},"status":"verified","checked_at":"2026-06-09","confidence":"high","summary":"AI2 Incubator is active with rolling admissions for applied AI founders; official pages publish a live application form, funding, cloud credits, and hybrid/remote support but no fixed cohort dates.","proposed_event":{"id":"ai2-incubator","name":"AI2 Incubator","description":"Rolling AI startup incubator with funding, cloud credits, technical support, and company-building help.","organizer":"AI2 Incubator","website":"https://www.ai2incubator.com/apply","location":{"is_virtual":false,"is_hybrid":true,"venue":"AI House","city":"Seattle","city_slug":"seattle","country":"United States","country_code":"US","region_code":"na"},"dates":{"application_open":null,"application_close":null,"program_start":null,"program_end":null,"demo_day":null,"timezone":null,"date_range_text":"Rolling admissions start anytime; 12 months of company-building support. No fixed cohort dates or deadline published."},"categories":{"types":["incubator","accelerator","program"],"supports":["funding","compute","mentorship","credits","resources"],"sectors":["ai","deeptech"]},"hashtags":["AI","AppliedAI","Incubator","Funding","Compute","Seattle"],"index":{"years":["2026"],"region_code":"na","country_code":"US","city_slug":"seattle","type_keys":["incubator","accelerator","program"],"support_keys":["funding","compute","mentorship","credits","resources"],"sector_keys":["ai","deeptech"],"date_sort_key":null},"verification":"reported","last_verified_utc":null},"sources":[{"title":"AI2 Incubator homepage","url":"https://www.ai2incubator.com/","publisher":"AI2 Incubator","accessed_at":"2026-06-09","supports":"Official homepage describes AI2 Incubator as supporting AI-first startups; states up to $600,000 funding at a $10M cap, up to $1,000,000 in cloud credits, 12 months of company-building, about 15 startups per year, remote support with quarterly Seattle visits or Seattle relocation, and Seattle/AI House location."},{"title":"Apply to AI2 Incubator","url":"https://www.ai2incubator.com/apply","publisher":"AI2 Incubator","accessed_at":"2026-06-09","supports":"Official application page is live and says AI2 Incubator partners with technical founders and domain experts to build applied AI companies; it provides a multi-step application form and does not publish a deadline."},{"title":"AI2 Incubator Framework","url":"https://www.ai2incubator.com/framework","publisher":"AI2 Incubator","accessed_at":"2026-06-09","supports":"Official framework page states rolling admissions start anytime, no relocation is required, and the program serves technical founders and domain experts building applied AI companies."},{"title":"AI2 Incubator Team","url":"https://www.ai2incubator.com/team","publisher":"AI2 Incubator","accessed_at":"2026-06-09","supports":"Official team page describes the incubator as born inside the Allen Institute for AI in 2014 and independent since 2022, supporting organizer and program background."}],"notes":["No exact application deadline, program start, program end, or demo day was visible on the official homepage, framework page, or application page as of 2026-06-09.","Official current funding terms differ from the imported source context: the homepage now states up to $600,000 in funding at a $10M cap, plus up to $1,000,000 in free non-dilutive cloud credits."]}