{
  "accelerator": {
    "name": "Accel Atoms",
    "website": "https://atoms.accel.com/",
    "csv_file": "src/data/imported-accelerators.json",
    "slug": "accel-atoms"
  },
  "status": "needs_review",
  "checked_at": "2026-10-27",
  "confidence": "high",
  "summary": "Accel Atoms FAQ explicitly describes rolling AI-cohort applications and participation for Indian and Indian-origin founders. However, the live application URL currently returns an upgrade notice rather than a usable form. Current application access needs confirmation.",
  "proposed_event": null,
  "sources": [
    {
      "url": "https://atoms.accel.com/faqs",
      "title": "Accel Atoms FAQ",
      "publisher": "Accel",
      "supports": "Rolling AI applications, Indian-origin eligibility, investment terms and solo-founder eligibility for Atoms X.",
      "accessed_at": "2026-10-27"
    },
    {
      "url": "https://atoms.accel.com/apply",
      "title": "Accel Atoms application page",
      "publisher": "Accel",
      "supports": "Live page displays an application-experience upgrade notice dated July 11 without a year; searchable cached application content differs.",
      "accessed_at": "2026-10-27"
    }
  ],
  "notes": [
    "AI and Atoms X are distinct cohorts with different investment ceilings. Do not promise a fixed equity percentage or an exact next cohort date. The FAQ and live application endpoint are inconsistent."
  ]
}
