{
  "accelerator": {
    "name": "Alchemist Accelerator",
    "website": "https://www.alchemistaccelerator.com/apply",
    "csv_file": "data/accelerators-master.csv",
    "slug": "alchemist-accelerator"
  },
  "status": "needs_review",
  "checked_at": "2026-10-26",
  "confidence": "medium",
  "summary": "Indexed official FAQ describes six-month enterprise acceleration and rolling application deadlines, but live pages failed to load.",
  "proposed_event": null,
  "sources": [
    {
      "title": "Alchemist official FAQ (search index)",
      "url": "https://www.alchemistaccelerator.com/",
      "publisher": "Alchemist",
      "accessed_at": "2026-10-26",
      "supports": "Rolling deadlines and typical 5% common equity with flexible terms; indexed official content."
    }
  ],
  "notes": [
    "Legacy apply URL redirected to alchemist.vc/apply, also inaccessible. No current cohort deadline verified."
  ]
}
