{"accelerator":{"name":"Antler Residency","website":"https://www.antler.co/location/us","csv_file":"src/data/imported-accelerators.json","slug":"antler-residency"},"status":"needs_review","checked_at":"2026-06-09","confidence":"low","summary":"Could not verify a currently dated U.S. Antler Residency application window from public pages. Official Antler pages confirm the residency model and U.S. location page/application URL, but public cohort dates or deadlines were not available in the gathered evidence.","proposed_event":null,"sources":[{"title":"Antler United States","url":"https://www.antler.co/location/us","publisher":"Antler","accessed_at":"2026-06-09","supports":"Official Antler U.S. location page for the accelerator/residency entry point."},{"title":"Apply to Antler","url":"https://www.antler.co/apply-new","publisher":"Antler","accessed_at":"2026-06-09","supports":"Official Antler application URL; useful for confirming where founders apply, but no verified current deadline or cohort dates were available from the page evidence."}],"notes":["No current public application close date, program start date, program end date, demo day, or stated timezone was verified.","Because current public cadence/dates were not verified, proposed_event is null rather than fabricating a stale or undated listing.","If later official pages expose a named 2026 U.S. residency cohort, create a dated event id such as antler-us-residency-2026 and include verified application/program dates."]}